Title Theme,Closest Summary Theme,Similarity Score,Difference Score
Wizarding world reform and rights advocacy,Social justice and equality in the wizarding world.,0.9040138296170129,0.09598617038298707
Character analysis and representation in series,Character analysis and development in the series.,0.9412272482199979,0.058772751780002075
"Critique of ""Harry Potter"" adaptations",Nostalgia and impact of the Harry Potter series.,0.8610195793532381,0.13898042064676186
Hogwarts and magical education discussions,Social justice and equality in the wizarding world.,0.8634449660713719,0.1365550339286281
Nostalgia and impact of series on fans,Nostalgia and impact of the Harry Potter series.,0.9233137476322661,0.07668625236773385
